Author,Comment,Likes,Published At
@user-ro3zv9uq7t,그렇게잘살았는대 뭐하러왔니,0,2024-09-06T06:20:01Z
@user-tw7ev8dv2o,어쩌라고..... ㅋㅋ    어디  남한  와서  지가  앨리트입네.  백두혈통입네  깝치고있어......그냥  조용히  살아라....  상위1%니.뭐니.  그딴  개소린  북한가서나  해.    지  삼촌이고  형이고  암살하는놈  옆에서  기생하던것들이  어디서  우월의식을  느껴......점잖게  받아준  대한민국에  고마운줄  알아야지.<br>.  무슨  지들이  대단해서  받아준줄  아나......세금이  아깝다,1,2024-09-04T12:35:00Z
@user-sh2pg2oj4k,17명이 일본군2000명을 박살 냈다고?그걸 사실이라고 믿는다고?,1,2024-09-03T11:38:58Z
@KyuheonLee,북한 금수저 출신들은 여기서 땀 흘린 노동의 의미를 진하게 깨닫기를 바란다.,1,2024-08-29T02:58:17Z
@young77777,북한에서 뇌물받아 잘 살았다는 분들은 참 해맑게 이야기하는데 인민 피빨아 먹고 살아온 건데 북한 사회가 그렇다해도 옆에 있는 사람들은 듣기 힘들 것 같다,2,2024-08-28T18:53:02Z
@terramask3422,진심으로 우리나라랑 다를바 없다고 생각하는 사람= 좋아요/ 우리나라랑 다르다= 싫어요 눌러봐봐,0,2024-08-26T15:09:29Z
@Cho-Eunji,"예전엔 평양출신 이야기 들으면 아무생각이 없었는데 북한의 실상을 조금이라도 알고 평양출신들의 이야기를 들으면 그 빈부격차와 비리, 비정상적인 체제에 냉소만 나오네요.",0,2024-08-26T14:45:14Z
@cailiancui2735,우리성주시정말어린나이에<br>잘하고처리하는<br>그모습<br>하나님의<br>천국에서니가정말잘한다<br>칭찬하고게십니다<br>나는울며은헤받랏슴니다<br>화팅<br>세게로........,0,2024-08-26T06:34:27Z
@cailiancui2735,성주<br>위력<br>두분<br>지난날의<br>고통과그환란이<br>미래에<br>기쁨과.평강이잇기를<br>간절히은총과축복을기원함니다<br>나도그렇게살앗서요<br>쓴맛과.단맛읆격어야<br>미래의위대한일군입니다<br>화팅,0,2024-08-26T05:27:13Z
@cailiancui2735,이성주<br>위력<br>두주인공들은<br>가난한자들을위하여<br>위하여겸손하고<br>아름다운마음<br>이땅의멧지모텔로사용하실줄믿슴니다<br>응원함니다,0,2024-08-26T05:07:38Z
@kyunakim4215,샤넬 짝퉁이겠지 보증서있으면 간단할걸 무슨 촉감타령,0,2024-08-22T21:55:04Z
@kyunakim4215,그렇게 잘 사는데 왜옴?ㅋ,0,2024-08-22T21:48:28Z
@dbekscna1004,아우 함경도 정말 목소리 억세고 듣기싫어ㅠ,0,2024-08-22T04:20:33Z
@user-gy8gu6jw6o,북에서 평생 그렇게 잘먹고 잘사지 왜처온거임,3,2024-08-20T14:54:43Z
@user-ut2ne9ur7w,뇌물받는게당연한듯..참....😮,0,2024-08-20T12:09:17Z
@user-ut2ne9ur7w,북한 썩을대로썪음.,0,2024-08-20T12:08:25Z
@jennylovemexico,성주씨 일화 진짜 리얼한 그시절얘기하는게 절절히 느껴지고 ..아직도 그 친구를 생각하고 기억하는 애틋한 마음도 느껴짐.<br> 맘아푸네 ㅠ,6,2024-08-19T19:05:41Z
@lsynavy,하루 500달러 쓰면...참....난 언감생심 꿈도 못꾸는데... 장난 아니네....,0,2024-08-19T04:58:12Z
@user-sy2ir4wu2b,잘살다.왓다그럼 대접이 달라지냐?역겹다.너간첩 특명받고 왓지?,0,2024-08-18T18:13:56Z
@밤비-w1o,"아직 3분의 1 정도 밖에 안 보고 댓글부터 다는데요. <br>저 정도로 북한에서 잘 사시던 분들은 왜 한국에 오신 걸까요?<br>한국에서 북한에서만큼의 상류층으로 살 수 없을 게 뻔하고<br>남겨진 가족, 친지들의 삶은 어쩌면 목숨까지 위험해질 텐데 이유가 궁금하네요<br>더 보면 나오려나..",0,2024-08-17T08:17:54Z
@user-su3hx5ss8u,모든 음악을 군가하듯 부르고 연주하는 북한 예술이 남한사람들한테는 촌스럽게 느껴지는 게 당연,0,2024-08-16T02:33:54Z
@user-su3hx5ss8u,윤설민은금성학원의 자부심이 큰데...한국성악가의 발성을 하찮게 얘기하는걸 보고 깜놀했슴 북한식 발성이 최고다...이런뉴앙스를 주드라구?,0,2024-08-16T02:32:27Z
@user-od1nt9zl3z,국세사회 호소 유엔식량 원조로 사는데 한끼 50만윈 자랑이나!<br>진짜 양심 있다면 절대 저런 말 할수없지 <br>당신이 먹은거 국제사회 원조다 알간,1,2024-08-14T16:23:03Z
@user-og4zv4bl1f,상류층에 살면서 진짜로 왜 왔을까요~이해가 안되네요~여기오면 새로 다 시작해야 하는데~,0,2024-08-11T16:37:01Z
@kyokyopark835,남희석 포함 패널들 왜이렇게 윤설미 꼽을 주냐 안 웃김....,0,2024-08-04T08:41:25Z
@user-tu5jz3hg8h,장마당꺼면 이미테이션이네 중국꺼,0,2024-08-02T11:44:29Z
@user-jl3kk4zw2d,자랑이다 자랑이야 굶어 죽는 사람들 생각하면 죄 받을거 같지않니? 근데 왜 왔을까?,0,2024-08-01T05:46:54Z
@eunheejo7751,저정도면 눈 가리고 아웅이지.<br>거의 출연자 보호는 안되있다고<br>본다.  <br>출연자를 속이는 거 아닌가<br>시청자로서 너무 화가난다,0,2024-07-30T19:27:10Z
@eunheejo7751,뭐하러 쓸데없이ㅣ 뒷모습까지<br>비춰주는지<br>정말 저급하다,0,2024-07-30T19:25:45Z
@eunheejo7751,어찌 자리 보야주려 애쓰나<br>출연자 보호를 제대로 해라,0,2024-07-30T19:24:59Z
@eunheejo7751,채널 TV. 출연자 보호. 제대로 하라,0,2024-07-30T19:24:05Z
@__-qg7yd,아니 부모가 능력이 되서 돈 썼다는데 댓글 왜들이래??,1,2024-07-27T19:47:58Z
@정명심-i8x,북한이란 나라도 잘사는 사람은 배터질정도 못사는 사람은 배고파 죽는  슬프다,0,2024-07-27T05:57:53Z
@user-td3bh7tq5t,윤설미 금성학원 중퇴 금성학원나왔다고그래,0,2024-07-26T23:00:35Z
@user-yu1ub7cx3g,북에서 탈북해서 다른나라로 가라 우리나라 세금만 쓰니 왕짜증 난다,0,2024-07-26T22:34:51Z
@두번째사바나,이프로그램 볼때마다 여자Mc 말하는게 너무 거슬려 여기 양주랑 저양주랑 다른게 뭐야? 가짜야 ? ㅋㅋㅋㅋㅋ <br>그냥 보기 불편하고 mc로써의 자격은 별론거같어,1,2024-07-26T18:40:34Z
@user-mk9qv3kc1j,근데 다른 패널들이 정말 부러워하고 우리도 못지 않게 산다고 주장하는 게 느껴져서...참 뭐랄까... 짠하기도 하고...상대적 박탈감 그 자체인데 탈북민들이 얼마나 솔직하고 순박한지가 보인다 속상해,0,2024-07-26T13:45:31Z
@user-mk9qv3kc1j,"상류층이라고 자랑할 게 아니지 않나.. 저긴 자기 능력으로 돈 번 게 아니라서 그 부유함만큼 사회의 책임을 더 져야 하는 위치였을텐데, 좀 당혹스럽네. 아무리 어렸어도 상층이면 사회의 교육을 받았을텐데..",3,2024-07-26T13:17:39Z
@user-ud9br6sq7o,마지막에  꿈을 이루기위해  왔다는데  북에서  한생활은  한국에서도  이루기  힘든데  왜왔지,0,2024-07-26T08:10:01Z
@user-ud9br6sq7o,한끼에 몇백쓰고  아파트는 전기가 안들어와  걸어올라가고  뭔말이야,0,2024-07-26T07:54:45Z
@user-ud9br6sq7o,한국에서도  저렇게  먹고  써면서  사는 사람이  얼마나 될지  저말이  사실이면  한국에 와서 고생만하고  산다고  생각할거  같은데  무엇해서  북에서  쓰듯이 하고할수 있죠,0,2024-07-26T07:51:50Z
@user-ud9br6sq7o,상류층이  저러면 북한에  사는게  낫지   한국에 올이유가  있나요,1,2024-07-26T07:44:14Z
@user-fz3iu9zd2h,어릴때 벼메뚜기 잡아서 기름에 볶아 먹었었는데 맛있었어요.,0,2024-07-25T23:45:20Z
@user-zf2ot2tx7c,이성주님 응원합니다,0,2024-07-25T12:09:02Z
@user-mu4kh7fl8m,"이성주씨, 가슴이 먹먹합니다. 잘사세요.",0,2024-07-25T10:12:29Z
@guptaneeraj9900,"<a href=""https://www.youtube.com/watch?v=ZfnijM4i_QQ&amp;t=2410"">40:10</a> 엄마 젊었을 때랑 완전 다른데? 눈코입 달리면 똑같은 건가? ;;;;",0,2024-07-25T02:08:44Z
@user-yg3gn8si5t,왜 탈북을했을까요?,0,2024-07-24T13:51:14Z
@user-wy5mu7cl9c,북한에서 금수저로 살다가 <br>탈북하면 남한에 와서도 <br>금수저로  사는것이  당연한겁니까?<br>자주나오는 금수저 다이아몬드수저 등등ㅈ의 단어를<br>참 많이도쓰는 이만갑..<br>물질만능주의가 깊게깔린 방송국이  아닌가하는 합리적ㅈ의심을 합니다..,0,2024-07-24T10:09:16Z
@user-sv5hp8yh9w,얼마나많은서민의피를빨았겠어김진옥좀닮라라부자티안내는,0,2024-07-22T06:01:46Z
@user-sv5hp8yh9w,그런데조빨라고대한민국왔냐,0,2024-07-22T05:56:53Z
@jeongoo1825,저 0.01퍼. 때문에 북한 폐쇄가 안풀리는거,6,2024-07-22T04:41:49Z
@user-yc8ub4nr1q,한끼에  5백 ? 적당히 후라이까라!  한국도 그런밥은 안사먹는다!,1,2024-07-21T03:39:13Z
@harimchoi6923,ㅠㅠ,0,2024-07-20T18:14:26Z
@donghyunpark8866,이게 사회주의의 본질. 한국 적폐좌파들 하는 짓 봐라. 국민혈세 퍼먹어서 강남 아파트 한두채는 기본이지. 하나도 잘난거 없고 아무 노력없이. 한국의 적폐좌파랑 북한의 공산주의가 본질적으로 뭐가 다르니??,1,2024-07-19T01:18:28Z
@user-xt8br5qi4r,상층부는 도적떼인거지요 이들의 향락을<br>정은이가 모르지않을것이고 자신에게 복종하고 3대세습에 추종한다면 어느정도 일탈하더라도 적당히하라는게 최고의 징벌일겁니다,0,2024-07-18T07:14:37Z
@user-rp2ni4vz6h,"<a href=""https://www.youtube.com/watch?v=ZfnijM4i_QQ&amp;t=2807"">46:47</a> 부럽긴한가보네",7,2024-07-17T23:14:30Z
@user-lf5pu3sx1q,평양상류층 저여자 아직도 북한에대한 자부심이 남아있네ㅋㅋㅋ 지가말한거 한국 중산층들이 누리고 있는건데 bmw도 지차도 아니고 아는오빠가 기사라 한번 타봤으면서ㅋㅋㅋ,10,2024-07-17T01:14:49Z
@user-ds9sm8nz6i,아......명철군과 친구들.....죽음의 순간에도 빵을 나누고 서로의 체온을 나눈....  그 비참하고 가슴 저린 사연을 방송이라 담담히 말하지만 문득 떠오를때면 통곡하고 울 사연을 가슴에 품고 더 나은 미래를 만들고자 열심히 살고있는 당신을 응원하고 더 큰 일 하실 날이 곧 오기를 기원합니다.,90,2024-07-17T00:29:23Z
@user-ob3zx9nh7k,김민교 여기 왜 나와 있어 ㅋㅋㅋ 깜놀,0,2024-07-16T04:52:58Z
@user-wi7fl4gv9l,참 기가 막힌다<br>북한국민을 착취한 돈을 그만큼 쓰고 산것에 미안한 마음으로 사죄를 해도 모자랄 판국에 웃으면서 자랑스럽게 웃고 즐거워한다<br>탈북민들에게 사과해라 <br>차라리 북한으로 다시가라,4,2024-07-15T12:55:49Z
@user-ir9vg1so7l,0.01% 일부 부자 면 2500~5000명이내 사람 당 최대간부 장군아님 국회의원들 전공 기타 평예  ::: 글쿤 전공하나만 금성학원 평양 예술 학원 금성은 아이들 소년 ~,0,2024-07-14T12:22:56Z
@user-zr2nh1tn3m,알들어오멸각자알아서도생하는거지뭐있어,0,2024-07-14T01:59:26Z
@이수인-l9d,상류층으로 살아온 사람은 남한 생활에 적응못할듯~,1,2024-07-12T03:58:24Z
@sensitivenerve,ㅋㅋㅋㅋ 북한 전방부대에 신병이 왔는데 저렇게 뚱뚱하면 ㅋㅋㅋㅋㅋㅋㅋㅋㅋㅋㅋㅋㅋㅋㅋㅋ 누가 건드릴 수 있갔어 ㅋㅋㅋㅋㅋㅋㅋㅋㅋㅋㅋㅋㅋㅋㅋㅋㅋㅋㅋㅋㅋㅋㅋㅋ 야 그 간나색귀는 중앙당 간부 아들급 뱃골인데 왜 대학 안 가고 사병으로 왔니 하겠네 ㅋㅋㅋ,1,2024-07-11T08:10:32Z
@user-cs8bf7mi7u,ㅎㅎ 미국 이라면 경끼 일으키며<br>욕하는 북한이 화폐가치가 얼마나<br>없으면 미국 돈을 쓰겠나,1,2024-07-10T10:47:25Z
@flumoonsky8408,고난의 행군시기에 행방갔다 회령역에서 5과에 있는 사람만났는데 굶어죽는 형국에 돼지고기도 개를주며 살았다고 하던데요.병보로 부모집에 왔다가 지방이 이렇게 험악한 현실인지 몰랐다고 하더라고,4,2024-07-09T21:20:27Z
@Deokgu_2020,남한사람들은 한국이라는 나라 안에 남한 북한으로 부르지만 북한은 북한으로 하고 남한을 한국이라고 말하네 서로 같은 민족이라고 생각하면서 남한사람들은 겉으로 한민족이지만 서로 다르다 라고 하고 북한은 대놓고 다른나라라고 보고있는듯,0,2024-07-08T15:08:12Z
@user-de8xu9cy7i,공산주의인데 빈부격차는 무슨ㄷㄷ<br>무섭다ㄷㄷ,0,2024-07-08T11:04:43Z
@user-so7ni3uw1j,"북한에서 고위층이었다고 자랑하는 사람들 정신머리는, 계급의식을 떨치지 못한 전근대적인 사고방식 그것에 다름없음. 선진화된 남한에 왔으니 계급의식 따위는 버리고 새출발해야하는데 그걸 인정하지 않고 자신을 계속 예전 계급으로 봐달라고 호소하는 덜 떨어진 인간을 본 것 같음. 남한에서 잘 대접받고프면 능력을 기르시오. 같잖은 북한부심 부리지 말고. 깡패 거지나라 북한의 상류층을 누가 부러워한다고 ㅋㅋㅋ",2,2024-07-07T16:22:41Z
@Erin-xf8xt,"안경쓴 여기자분 목소리 넘 무섭넹,     공포 영화  얘기하는줄 .",1,2024-07-07T08:37:57Z
@yongkwon909,"참! 어이가 없네. 그리고 화가 난다. 그렇게 잘먹고 사치부리며 살았으면서 왜 우리나라에 왔지?!? 어린아이들도 먹지 못해 굶어죽고 있다는데.  왜 우리의 값진 세금을 저런 사람에게 써야하나,,, 대답하는거보니까 잘난척하러 방송에나와 떠들고 있는것 같네. 겸손부터 배우고 다른 사람들에게 미안함을 느껴야하는게 먼저 아닐까",4,2024-07-06T21:21:29Z
@user-zt4po2om1j,시골 병원장 딸이 상류층이라고?<br>뻥치지 마라!,2,2024-07-06T08:20:37Z
@sooojin1,우리나라에서 북한을 추앙하는 사람들 정신 좀 차리길,0,2024-07-06T07:47:05Z
@lsynavy,난 이걸 보면서 설국열차 가 생각 나네요...<br>내용이 완전 똑같음.,13,2024-07-06T06:27:57Z
@user-kj4ct5pq6s,😅,0,2024-07-05T19:38:05Z
@beagopa88,정신은 아직 북에 놓고 오신 듯;;,10,2024-07-04T23:31:37Z
@johan7124,서민들은 굶어죽어가는데<br>자신들은 괜찮았나? 진짜 어이없다,3,2024-07-04T02:58:30Z
@zimmersue2595,짝퉁이지 촉감 좋아하네.,3,2024-07-03T04:03:07Z
@lsynavy,평양 상류층 에서 태어나서 뭐하러 한국에 왔을까?.......평양 상류층 이면 어느 정도 자유가 있을 텐데...... 한국 오면  밑으로 내려 가는 건데....,13,2024-07-02T09:49:27Z
@hyeonjunkim9086,샤땡 -샤넬,0,2024-07-02T00:58:26Z
@seoungho,"세뇌가 무섭긴 한데 우리나라 와서 웃고 계시고 좋은 옷,음식,환경 누리고 계시니 저희가 다 뿌듯하네요 ㅎㅎ",3,2024-06-30T23:18:46Z
@robertdr.2312,"얼굴 공개하고 나와서 솔직하게 얘기해준 게 고맙네..  북한을 탈출하는 입장은 김정은 앞에서는 다 똑같으니 빈부차이를 따져서 몰아가기에는 이치에 맞지 않는것 같다. 저 여성이 자신들을 착취한 것도 아니고, 병원장아버지도 누굴 괴롭혀서 산 것이 아닌만큼 탈북민의 입장에서 같이 잘 지내길 바란다. 오히려 아득바득 거센 이미지를 가진 탈북민의 이미지를 저 분이 순화시켜주는 역할도 있네. 탐관오리 자식도 아니고 예쁜 얼굴도 아닌데, 부를 뽐내지않으면서 교양있게 말하는 말씨와 매무새는 남한사람 입장에서 보기에도 참 곱다~  거꾸로 내가 북한에 가서 인터뷰를 한다면 교양있는 모습은 못보여줄 듯 한데, 잘 자란것 같네. 근데 제작진이 구성을 잘못 짠거 아냐? 극과극을 보여줘도 그렇지, 꽃제비생활하다가 맞아죽은 설정이랑 붙여놓으면 어쩌자는거야?  저 여자가 악의를 가지고 인터뷰한 것도 아닌데 이런 흐름으로 만들면 탈북민들 사이에서 어디 적응할 수나 있겠어? 왕따를 조장하는게 아니리면 말이지. 오히려 제작진의 악의가 숨어있는 게 아닌가 의심스럽네!",4,2024-06-30T16:07:55Z
@user-vk8zd6ox7j,근데  왜  탈북  저여자,0,2024-06-30T04:54:40Z
@monsuwoo8251,들으면 들을 수록 북 정권에 화가넘어 치가 떨리고 그런 북을 옹호하고 지지하는 단체와 좌파집단 의원들에게  저주를 내리고 싶네요,1,2024-06-29T16:16:17Z
@user-fi1ft6kh6y,평양 고위층 자녀가 왜 탈북했습니까? 저 여자 이북식 표현으로 (애미나이)는 참 싫으네요..  그냥 평양에서 평생 살지 그랬나요? 평양출신인데 타고난 북한말투는 어쩔 수가 없나보네~ 북한티가 너무 나는군요.,28,2024-06-29T13:52:51Z
@liveonce33,병원에 링겔이 없어서 사제로 사가야하고 마취약이 없어 마취없이 맹장수술한다는데<br>병원장 가족은 호의호식 한 건 자랑은 아니다,4,2024-06-29T05:03:30Z
@hola-rr5ru,대답을 할때 머리를 만지거나 눈을 위로 뜨는 행동들은 거짓말을 하고있음을 알려주는 직접적인 신호입니다<br>그리고 평양에서 휴롬 착즙기/원액기는 100달러가 아닌 1000불 이상에 판매됩니다.,31,2024-06-29T03:38:26Z
@minsunamgung8103,딸때문에 가족들 아오지 가는거임??,0,2024-06-29T02:19:39Z
@cypark2268,저렇게 평양에서 살아 먹으려면 얼마나 인민들의 피를 뽑아먹었을지 뻔하다.,56,2024-06-28T17:04:19Z
@fjfkkfjd3882,중국에서 짭퉁 가져와서 판거 사서 썼을 듯 ㅋ,6,2024-06-28T11:22:23Z
@dusfo3360,"돈줄을 더 조여여 한다!!<br>그런데,<br>왜? 탈북했나??",6,2024-06-28T09:12:56Z
@cocoapple6443,북에서 저 정도로 잘 살았다는게<br>결코 자랑이 아닌데....ㅡㅡ,56,2024-06-26T01:05:35Z
@user-yr9xm1ij5b,북한도 한심한 인간들많쿠나,3,2024-06-25T23:15:39Z
@lsylsy123,위장간첩들 보인다,1,2024-06-25T10:43:13Z
@user-vh7nz6xn5r,성주씨!! 생긴건 귀티 좔좔~~,8,2024-06-24T17:21:53Z
@user-tb8tk6fx8l,이성주님 응원합니다.,8,2024-06-24T11:36:15Z
@minakang8105,근데 왜 최선희라는 분은 김정은 바로ㅜ옆에 있는 사람인데 샤넬 향수도 못사서 하나 사달라고 부탁했을까 ..직원들 밥도 못사줘서 부탁하고 뭐야,0,2024-06-24T07:48:28Z
@luna_smp_studio,왜왔지..? 아부지가 여행보내줫나. 잘살면 거기있지 왜왔어..??,3,2024-06-23T16:26:02Z
@user-nx6nl2xb9m,잘살아도 줄잘못서면 장성택처럼 고사포행됨,4,2024-06-22T11:30:46Z
@ilhwanoh1209,그럼 왜 왔지,0,2024-06-20T19:19:30Z
@freshever5719,우린 우상화 안 해도 국군통수권을 가지는거 어렵지 않아요.,0,2024-06-20T12:37:51Z
@user-xd7du9ys3t,그렇게 잘 살았다며 한국은 왜왔데😨저 남MC얄밉네 설미씨한테 하는말도 얄밉고 신났네 신났어,5,2024-06-20T09:35:40Z
@user-qt4ej3ye9m,북한에서 지역넘어가는것도 쉽지 않다는데 ㅋㅋㅋ 후임 한번 볼라고 평양까지 갔다는게 말이 안되지 ㅋㅋㅋ,4,2024-06-19T06:23:13Z
@user-qz3lq3hs9t,100달러면 싸구만 요<br>한국에서 녹즙기  30만원에 삿는데~,2,2024-06-19T04:19:58Z
@user-ux3sh4ke8b,무서운게 우리나라도 저렇게될수도. 지네1프로만 잘사는나라를 꿈꾸는 부류들이있지 공산당,3,2024-06-18T11:43:38Z
@user-jq1uv1dk8m,북한은 이미 공산주의가 무너진 것으로 봐야 한다.,1,2024-06-18T05:13:43Z
@user-tw9oq5le4i,나도 강냉이밥못먹었는데...,0,2024-06-16T22:27:24Z
@user-tw9oq5le4i,윤설미도 별로네임다,1,2024-06-16T22:09:45Z
@lelaleslo,그런데 왜 탈북했을까?,35,2024-06-15T05:56:01Z
@asfinagtransport3325,제작진 제정신인가? 저걸 저기 붙이면 저 아가씨는 뭐가 되라고? 그냥 나쁜 인간 만들었잖아. ㅉㅉ,2,2024-06-15T03:22:36Z
@user-zy9pf2ds4g,대단한 넘들이다 썰로 한시간을 채우네,6,2024-06-15T02:49:06Z
@user-jl8om5xd9r,김길선님 안경만 벗어보세요 사람들 다 놀랄거예요,0,2024-06-14T22:26:37Z
@ysh5944,북에서도 아빠라고 부르나보네요,0,2024-06-13T01:54:55Z
@lovelykim1708,인간이 어디까지 잔인 할 수 있는지 몸소 보여주네요 웃음이 나나요? <br>같은 북한 하늘아래 얼마나 많은 사람들이 잔혹하게 굶어 죽어 갔는데 다른 것도 아닌 호사스럽게 먹고 살며 누린 것들에 대해 웃으면서 과시할 수 있다는게 정말로 소름끼치네요 본인의 잘못은 아니지만 당신들이 뻔뻔스럽게 누린 특권과 혜택들을 제공하기 위해 개처럼 일하다 죽어간 인민들과 병들고 굶어 죽어간 아이들에 대해서 최소한의 죄스러움과 미안함은 없나요?<br>북한에서 집단봉기일어나면 당신들 같은 부류부터 죽창 맞습니다,36,2024-06-12T09:52:04Z
@user-bh4cq9kj9d,그런데 왜 왔니???---북한 자랑하러 온 여인!!!,12,2024-06-12T08:27:39Z
@153Hotaru,북한에서 그만은 돈을 소비할데가 어디있지!!??,4,2024-06-12T05:28:21Z
@user-tu7xh4ok2s,그렇게 잘살던분이 어덯게 한국으로왔는지궁금하네요!!,78,2024-06-11T12:31:27Z
@hyunwonyi4213,평등한 사회 만든다는게 공산주의 아녔어?,2,2024-06-11T10:06:57Z
@user-mt7qt4ui8i,탈북민  한국에서도 여전히 힘들다 상위일프라,0,2024-06-11T08:09:05Z
@jackie5175,이성주님 응원합니다~!,40,2024-06-11T01:28:06Z
@goood_art,설미님 이때 말투 완전 내숭이었구만유?~ㅎㅎㅎ,6,2024-06-10T03:31:08Z
@youngmeemoon9054,저 전직 국정원 사람은  마치 북한의 보위부 간부같이 말하네. 종북인가?,1,2024-06-09T13:01:23Z
@user-lt4eg6yq1l,제발 말섬은ᆢ,0,2024-06-08T19:51:57Z
@user-hf4dr5se9v,ㅇㅇ❤,0,2024-06-08T19:49:49Z
@kyoungs109,어떤 나라는 병역기피자가 대통도 하던데... 그래서 이 모양이겠지?,0,2024-06-08T04:53:48Z
@김도훈-l2p,일제청산은 참 잘한듯 하네요,0,2024-06-07T20:10:30Z
@user-eb4tn3zn7o,어디든 특권층넘들이. 잘해야 국민들이 잘산다 우린 어떤가??,0,2024-06-07T11:00:59Z
@user-tb8zd3sf9r,북죠선 선전원?<br>ㄱ곳,2,2024-06-07T02:59:19Z
@user-kh6di4st6h,하  나선시 친구 이야기 너무슬프다,36,2024-06-06T15:35:25Z
@신성욱-l1w,그때 그때 싱싱하게 먹어야지 미리사서 하루지나면 맛없는데 소량판매 시장이 형성이 안돼서 맛이없어도 어쩔수가 없이 짝으로 구입해야되는 불편한점이 있겠네,1,2024-06-06T08:25:51Z
@김주현-u6v,고위층은 어디나 존재하는 법.<br>한 테이블에1억짜리 술판이 흥청망청인 강남클럽 버닝썬 몰라?<br>전쟁중인 우크라이나 젊은이들 스위스 터키 호텔에서 춤추고 노는 영상 못봤나?,8,2024-06-05T23:50:43Z
@user-ny4su1zv3z,부칸놈들도 달러는 좋아하나보군.<br>미제 승냥이라구 욕하면서...<br>뭐니뭐니해도 미국머니가 최고구나야.,11,2024-06-05T22:40:32Z
@user-ny4su1zv3z,30층 아파트를 걸어올라간다구?<br> 차라리 땅집이 낫겠구나야.<br>우린 60층에도 물 팡 팡 올라간다야.<br>게임 끝난거 아니야?<br>손 들어라 이것들아.,12,2024-06-05T22:33:36Z
@user-ny4su1zv3z,저것들은 악단이름도 끔찍하다.<br>피바다가극단?<br>말만들어도 섬찟하네요!!!,45,2024-06-05T22:30:59Z
@satsko_art,"이성주 님, 북한에서 꽃제비로 살던 고통스러운 시기를 견뎌내셨지만, 북한정권의 혜택을 누리며 금수저로 살았다고 말하는 출연자보다 100배 1000배 더욱 귀하게 살아온 분 같아요 ♡♡♡",119,2024-06-05T17:16:40Z
@김동순-z7g,밥값 50만원썼다고 자랑하는 저 ㄴ 부끄러운줄 알아야지 !  🤛🤛🤛,14,2024-06-05T16:07:43Z
@jameskim-ww4nq,길선 누님은 남조선 말을<br>안배우시는가 봅니다.,7,2024-06-05T08:16:44Z
@user-yk5ni8if9i,모자이크여자 탈북자입에서 어떻게 저런말이 현제북한상황은 모두다아는데 그렇게좋으면 다시 가시는게..,29,2024-06-05T03:42:30Z
@user-fz2vf5fn6u,"뛰어난 지도자없이 군중들이 잘해서 잘된 나라는 인류 역사상 없읍니다,<br>그런데 그런것을 우기는 사람들는 대체로 무지,무식한  대중이지요",0,2024-06-05T01:21:38Z
@user-fz2vf5fn6u,지난 50여년간 한반도의  南과  北에서 일어난 현실을 정확하게  파악하고  길지않은 멘트로 요약하여 설명하신것 같아요 ..<br>기회가되면 한번 모시고 더 깊은 토론을 하고싶네요.<br>그리고 김태산님의 말씀하시는 스타일과 인상을 보니 남과 타협없이 소신을 솔직하게 말씀하시는 분이라는 <br>강한 인상을 받았읍니다.,17,2024-06-05T01:18:38Z
@user-yk4xs4vn4n,이때만해도 유나씨 말투가 영락없는 북한여자네요ㅋㅋ,1,2024-06-05T00:53:31Z
@user-dm5oj8zy5d,김정숙 이여자는  한끼 식사비가 15 500 000 만원씩 쓰는 여자여 이여자는 배지가 저수지 라나 참 만이 들어간다,0,2024-06-05T00:04:31Z
@이또한지나가리다-w4i,주성하 저사람 말은 믿음이 안 간다. 주성하 저사람 탈북한지가 ...,0,2024-06-04T23:03:21Z
@루루-s9j,공산당놈들 공평하다는건 다  새빨간 거짓말 믿으면 안된다ㅠ,0,2024-06-04T10:16:31Z
@user-id1gp5vv1k,악당 돼지 가족의 미담 경쟁이구나,0,2024-06-04T06:37:42Z
@JamesLee-wb7xq,거짓말 장이 윤설미 저기서 또 거짓말 하네,2,2024-06-04T06:18:19Z
