Author,Comment,Likes,Published At
@pretty4884,"본방 봤는데 버스만  남녀 갈라서 타고 택시도 같이 타고 병원 진료,시장등 길에서 다 마주치는거 샘처럼 나도 이해 안가던데 유세윤이랑 안정환 자꾸 왜 자꾸 태클거는지",4,2023-10-29T23:18:38Z
@피스-d2b,처가집이 부자집같네.할아버지 할머니도 사람 좋아보이고~~장가 잘 간것 같네요~~,40,2023-10-29T15:42:03Z
@205Brigade,"태클은 아닌데, 이 분 한의사가 아니고 중의사임.  🇨🇳 중국에서 중의학 전공.  현재 이란 거주.<br>영상에는 안그런 부분만 비췄지만, 병원 내부도 완전히 중국풍으로 꾸며놓았음. 중국그림, 붉은 한자 등등<br><br>그리고 이란 아내가 한국 의사남편 만나서 자유롭게 호강하면서 산다고 국뽕 느끼는 분들 많은거 같은데  ㅎㅎㅎ<br>친정이 잘 살아요. 분위기도 자유로운 집안이고.<br>오히려 한국인 남편이 이란 부잣집에 장가가서 병원 차리고 잘산다고 말하는게 논리적으로 맞을듯.",130,2023-10-29T10:02:53Z
@리치몬-r7c,"와. 뻔하고 식상한 유럽, 미국부부만 보다 중동부부보니 너무. 좋고 신비롭네..  이제 중남미, 아프리카, 동남아시아 국제부부들 좀 많이 봅시다",81,2023-10-29T07:18:19Z
@Happymom58,장인장모님이 한국사위보는게 딸이 자유스럽게 살수 있어서 너무 좋아하셨을듯요.,127,2023-10-29T04:52:21Z
@tonmephil,"가고싶은 나라 증 하나인<br>국가인데, 빨리 자유로운 이란이 되었으면 좋겟습니다🙏",59,2023-10-29T04:33:53Z
@user-xw1gh3pp6l,이란 여성분 복 받으셨네..한국 남자랑 결혼해.자유롭게 살고..,254,2023-10-29T02:49:55Z
@mins6969,이란에서 의사 자격증없는 불법 의사 아닌가요? 이란에서 한의사를 인정해 줄리도 없고,16,2023-10-29T00:28:29Z
@까망-p9f,너무  이뻐요  아이들이❤❤,28,2023-10-29T00:12:26Z
