Author,Comment,Likes,Published At
@user-sg9kg8ix7p,"지금 테헤란로는 팔레비 왕조 때 이란이고,,, 현재 이란은 러, 북이랑 테러 저지르는 나라고,,, 팔레비왕조의 이란은 좋지만 지금은 테러 국가 맞잖아,,,",2,2024-08-13T03:22:09Z
@user-zi7yn2nl6m,아주좋아요,1,2024-07-25T14:47:31Z
@TmO2O21,"<a href=""https://www.youtube.com/watch?v=vqKdRLoM7j8&amp;t=277"">4:37</a> Arabic song ????? 😭😭 <br>Iran is Persian country 😬 <br>Persian coutries : 🇮🇷🇹🇯🇦🇫",0,2024-07-18T13:32:06Z
@jeekgardel2662,이란과 이스라엘 친하게 지내길,0,2024-07-12T06:27:03Z
@dbstjy7639,국제결혼은 참 행복한 일인 것 같아요! 서로 다른 문화임에도 불구하고 이해하는 모습이 아름다워요. 하지만 그만큼 현실의 벽에 부딪치는 갈등이 있을 거라 생각해서 쉽지 않을 것 같네요....ㅜ,3,2024-06-08T13:38:23Z
@user-dt7kg9il3n,예전 인간극장에서 이란여성들 보고. 미인들잊 많아서. 정말 놀랐던 기억이 나요. 알렉산더 대왕이. 페르시아를 정복한뒤. 거기여자들이. 너무 아름다위서. 몇달동안. 눌러 앉아있었다는. ᆢ잠재력이. 많은 나라인데. 안타깝네요. 핵이. 있어서. 함부로. 할 수있는 나라는 아니지만. 미국과 대립해서 잘되는. 나라는 없던데,1,2024-05-29T13:27:30Z
@arefeh99,이란에 대한 언론의 거짓말에 귀 기울이지 마세요..이란 여행을 후회한 사람은 없습니다.,0,2024-04-12T21:52:14Z
@arefeh99,"가짜 언론으로 진짜 이란을 모르는 이란은 친절한 사람들과 고대의 역사와 문화를 가진 크고 아름다운 나라입니다... 이란을 다른 나라와 비교하지 마세요, 모든 나라에는 고유한 문화와 전통이 있습니다... 보시죠 이란의 아름다운 자연과 그 곳의 역사와 맛있는 음식에 놀라게 될 것입니다.",1,2024-04-12T21:50:24Z
@user-lp3yc1kf6s,복받길빕니다,0,2024-04-04T01:53:15Z
@user-vo8vp2jr8y,이란사람들 개개인은 하나같이 좋은데 집단이 되면 이슬람 과격파가 된다,0,2024-04-01T16:39:05Z
@user-ty8tx4nz3i,안정환 과마누라진짜사회못보네,1,2024-03-29T19:20:21Z
@307signal,"국적을  넘은 사랑  존중하지만<br><br>아직은  이란은  적국이다  북한과 더  많은교류와  지원을 하는국가<a href=""UCkszU2WH9gy1mb0dV-11UJg/7cIfY5niDOmSkNAP08CA6A4""></a><a href=""UCkszU2WH9gy1mb0dV-11UJg/7cIfY5niDOmSkNAP08CA6A4""></a><a href=""UCkszU2WH9gy1mb0dV-11UJg/7cIfY5niDOmSkNAP08CA6A4""></a><a href=""UCkszU2WH9gy1mb0dV-11UJg/7cIfY5niDOmSkNAP08CA6A4""></a><a href=""UCkszU2WH9gy1mb0dV-11UJg/7cIfY5niDOmSkNAP08CA6A4""></a><a href=""UCkszU2WH9gy1mb0dV-11UJg/7cIfY5niDOmSkNAP08CA6A4""></a><a href=""UCkszU2WH9gy1mb0dV-11UJg/7cIfY5niDOmSkNAP08CA6A4""></a>",5,2024-03-07T18:38:39Z
@user-yy5pb1dx4g,일본도 옛날 중세시대때까지는 기본성과 중간성이 존재해서 이름이 겁나게 길었죠. 그래서 일본 사무라이들도 이란인만큼 이름이 겁나 길었는데 현대시대에 들어서는 일본에서 중간성은 더이상 안쓰는데 이란은 아직도 중간성이 있었군요.,1,2024-03-04T01:02:20Z
@secondgenie,나! 이란싸람이야~~~ 라고 DJ DOC가 말했지.😊,0,2024-02-11T15:45:17Z
@enan1468,Wife looks much older.,0,2024-02-09T19:59:09Z
@홍-t2n,술이랑돼지는 포기할수없어,0,2024-02-06T20:07:42Z
@user-hg4qd4lf2g,한국 남자와 이란 여자와 결합 인종개량 하면 최고의 인간이  나올것 같습니다,0,2024-02-01T13:34:19Z
@angelwink,무슬림이네 쩝,0,2024-01-20T07:03:06Z
@G80G70,역숴 이란. 우크라와 더불어 미인의 나라라고 하더니만..,0,2024-01-18T12:33:41Z
@jip3705,빨리 이란에서 탈출해야 되는거 아닌감요..중동전쟁이 확산 될 수도 있으니 얼른 한국으로 들어오세요..,1,2024-01-17T07:05:45Z
@리대리-f3l,참 이리 보면 사람사는곳 다 똑같은데 국제 정세 보면 이란이란 나라가 참 ...,1,2024-01-15T05:16:10Z
@user-hi5ct1qz8d,비행기에서 이란 애기들탔을때 뛰어다니고 난리쳐도 부모가 안말려서 개열받았는데 저긴 어린아이들한테 뭐라안하는게 문화라니 진짜 또빡친다,8,2024-01-13T15:23:56Z
@thebrilliance90,경희대 1300억 기부한 분 보니 이란 한의사 떼 돈벌던데,0,2024-01-12T11:47:54Z
@ernieball20,이란인들은 자신들이 중동의 아랍족이 아니기 때문에 사우디나 쿠웨이트 사람과 비교당하면 불쾌해 합니다. ^^ 자존심 강하고 똑똑한 사람들 입니다,1,2024-01-10T05:49:18Z
@user-dc4mw7id1g,"한의사 아니십니다, 중의사로 추정되고, 한의사는 한국에서 한의대 졸업해야 불리울수 있습니다.",0,2024-01-10T02:54:44Z
@gprix3953,솔직히 이란 완전 후진국이지....80년대 이슬람 원리주의자가 집권해서 시대를 역행하는 국가정책으로 나라 개판됨 중동의 북한이 이란임...,0,2024-01-04T16:22:49Z
@gggggg-w8s,페르시아 여성이 이쁘긴 하네요 성형없인 못생긴 한국중국일본 여자랑은 DNA가 다르네,1,2024-01-01T16:00:17Z
@seonkyukim5935,👍👍👍,1,2023-12-26T22:09:02Z
@user-wu7bl9tu6j,중의학<br>ㅡ 믿음이 안가요?,0,2023-12-25T09:02:03Z
@user-lj4rm3mj7l,이란  공산당 아냐?,0,2023-12-24T04:38:48Z
@mathadmission1742,세계적으로 금값은 거의 비슷합니다. 질량에 따라 달라짐.,0,2023-12-21T01:36:35Z
@머시다냐,아니 한국 와서 살지 왜 이란에서 위험하게 시리 ;;,0,2023-12-19T04:55:55Z
@오프로보험,태어 났더니 책에서만 보던 페르시아가 엄마의 나라...ㄷㄷㄷ,4,2023-12-18T12:07:11Z
@AsalPazhohesh,خیلی باحال بود دمتون‌گرم<br>ولی کاشکی زیرنویس فارسی داشت فاطمه جان❤,0,2023-12-17T08:43:45Z
@user-lk3gp9im6b,무슬림이 자랑거리인가?,1,2023-12-15T08:48:26Z
@chasekang-qy9ie,와 근데 여자때문에 무슬림으로 개종하고 자식들도 무슬림 만드는게 과연 옳은일인가.. 것도 극단적 무슬림 본고장으로가서..,11,2023-12-14T19:53:15Z
@jangjung3469,이란 ? 지구상에서 말살시켜야 할나라,1,2023-12-14T03:50:39Z
@오늘도주하루,거기서 영원히 살아요<br>다데리고 한국오지말고.<br>이슬람 소오름~,2,2023-12-13T14:07:34Z
@user-jy6yk9wy4d,"구원얻을 이름은 오직예수 밖에는 주시지 않았음, ㅡ예수천당,불신지옥,이단지옥, ㅡ기독교인",0,2023-12-12T21:23:21Z
@user-lo2pu2qi9e,피부가 반짝반짝 광채가,2,2023-12-11T05:46:35Z
@빠방pabang,요분들은 보기에 좋아,1,2023-12-11T01:29:54Z
@빠방pabang,김 수한무 거북이와 두루미  삼천갑자 동방석,0,2023-12-11T01:29:12Z
@hwangyunchang0,남편도대단하고 여성분도 사랑스럽다  두분 행복하세요,21,2023-12-10T21:05:49Z
@user-hd8yx1vx9i,"70년대 이란여성과 결혼한 의지의 한국인 있어요! 신문에 나왔는데 그분 근황이 궁금합니다.<br>기억으로는 그때당시 결혼하면 외국으로 못나간다고&lt;여성과 함께&gt;하였고, 팔레비왕권 무너질때 엄청 고생했다고 신문에 나왔었는데~~",1,2023-12-10T16:56:20Z
@Jay5100,히잡이나 먼저 좀 벗고 나오길,1,2023-12-10T14:51:53Z
@해피맘-o8c,이슬람 여자들  답없네요 <br>피임도 절대안하고 아이는 우굴우굴 방으로 가득 낳아놓구 고생고생 개고생,1,2023-12-10T01:38:25Z
@해피맘-o8c,아내분 복받으셨네요 <br>머리머풀러도 벗어보구 <br>치렁치렁한 드레스도벗고ㅡ<br>이란법에 이란남자들은 와이프한테 폭행도 잘하고  4명의 와이프 까지 허용이된다던데ㅡ,2,2023-12-10T01:31:32Z
@user-fr6en6qz3w,아가들이쁜거보소ㅎ,3,2023-12-08T16:51:40Z
@user-ni3zk7fy7u,애들 진짜 이쁘네.<br> 잘생겼네.,6,2023-12-06T17:29:39Z
@hagmlkim9097,아들래미 둘다 너무 귀엽고 똑똑하게 보여요,3,2023-12-05T20:10:36Z
@성식김-v8t,"엄마가 진짜 미인이라서 그런지 어느새 키운 두아들이 너무 잘 생겼네요,또한 애기아빠가 이란에서 유일하게 한의사이고 대단해요👍👍👍👍👍",43,2023-12-05T10:36:57Z
@user-xl8dh8vo2p,국제결혼이  찐 답이다...    고추장 된장 녀  님  들  중국으로 이제 가셔야 할 듯....,0,2023-12-01T13:23:48Z
@user-le9ud9tw8q,이혜원씨 성격참 털털하시네요<br>반전매력 좋아요 <br>부부가 얼굴도 닮아가는거같아요<br>행복하세요 ^^,1,2023-12-01T06:45:11Z
@sangsangnori,"헐......... 이거 보다가 놀란점이,<br>&#39;뭐... 상대방 종교 요즘 크게 신경 안쓰는데 그게 그렇게 힘들었을까?&#39;<br>했는데~~~<br>두둥! 아버지가 목사님... 그것보고 헉 나왔음 ㅋ<br>그래도 잘 사시네요~ 행복하게 잘 사시길 기원할게요~ ^_____^",2,2023-11-29T13:25:22Z
@현-t3w,와우! 아들들 핸섬가이!!!❤,6,2023-11-28T13:01:21Z
@이주영-k4m,저희 남편도  자꾸  결혼선물로 금을 주는 거예요. 니 금테크 하나 웃었는데 진짜  그러다 6년 모으고 코로나로 금값 폭등할때   다 팔아서 시세차익 좀 벌음 ㅋㅋㅋㅋㅋㅋㅋㅋㅋ,1,2023-11-27T01:55:32Z
@user-hd4uf6mh7l,이란에선 술 못먹자나요..ㅠㅠ,0,2023-11-26T18:51:54Z
@user-dz6rq3mi8f,정신 넋빠진놈 결혼할 여자가없어서 이슬람하고 결혼하냐 니자식들 알라알라 외쳐서좋겠다 진짜 무지한것같으니 저런건 한국국적 취소해버려야 이란귀화해라 오지마라,0,2023-11-26T11:02:18Z
@Dioxine666,내가 알기에는 출연자는 중의사인데 왜 한의사라고 제목 달았냐? 중의사는 한국에서는 의사 아니다. 왜냐면 중의사는 되기도 쉽고 한국하고 수준차이가 많이 나기 때문이다. 제대로 제목 표기해라,4,2023-11-26T02:33:42Z
@빠방pabang,우리나라 60년대같은   자동차거리   여유롭다,0,2023-11-25T07:24:49Z
@빠방pabang,금에  성경말씀 적으면 멋나겠다,0,2023-11-25T07:21:11Z
@빠방pabang,이란 파키스탄 분들이     인도  뭄바이쪽  미치  인천쪽항구도시쪽 분들이라 외모가    와우    우리나라보다  머리수도    열배는더 되니까   우리나라도  이전에는    열명씩 낳아 키우는거는 기본이었는데    먹을거넘치는 지금 우리는 뭐하는건지     여성분들이   더 많은    기회를    하시면서 아이들도 많이 기를수있는 환경이기를,0,2023-11-25T07:16:33Z
@lidiahill5852,красивая и очаровательная девочка.,1,2023-11-23T17:20:58Z
@user-re9hm3cw8g,옛날엔 아니었는데 <br>요즘엔 한국여자보단 외국여자가 나은거같다 외모나 인성이나,2,2023-11-21T05:55:17Z
@user-fj3um3vg5g,알리바바 나라 맞나요?,0,2023-11-19T13:11:18Z
@JamesKIM-es4jx,이란 가고싶다,2,2023-11-19T11:51:23Z
@hsa1308,남편분이 미남이고 자상한 성품일것같습니다. 오래도록 건강하고행복하게 잘 사세요,4,2023-11-18T23:42:00Z
@user-on9uw2gx7o,아이들과함께 행복한 패밀리 모습 긋!,7,2023-11-18T21:56:36Z
@user-nw4iy2yr4u,이란  사람들 정서는 정이 많은 우리와 비슷한듯...다만 아쉬운건  미국에  넝수 적대적이라는것,4,2023-11-16T23:39:46Z
@user-fx2dq9df49,정확하게 합시다. 한의사?<br>중국가서 공부한 사람입니다.,3,2023-11-16T03:00:19Z
@gdlee2439,어디 중의대 나온 돌팔이구먼 뭘.... 한국에서 한의사 할수 없으니 이란에서 하는거네.. ㅉㅉ,3,2023-11-15T17:54:22Z
@user-mf4gh8gj9r,돈도 없고 빽도 없고 능력없고 탈모인 40대 인도로치면 불가촉 천민인 저같은 조선놈은 꿈도 못꿀 일이네요 부럽습니다,1,2023-11-15T03:53:35Z
@youngkim6769,"이란은 지구상 최악의 무슬림근본주의 빌런이다. 부카니스탄과 핵무기 기술도 공유하는 적성국인데,,,중공에서 중의를배우고  병원도 중국식으로 치장한다던데, 한의사로 구라치는 자를 미화하고 쉴드쳐주는건 뭔짓인가??????????? 부럽다고 빨아대며 댓글다는 꼬락서니도 참,,,",2,2023-11-13T23:56:21Z
@j.y.5276,남편분 한의사라니!  틈새시장 완전 잘 공략했네요,44,2023-11-13T06:31:24Z
@j.y.5276,두 아들들 진짜 잘생겼다😍....혼혈이라도 다 미남.미녀가 나오는게 아닌데 진짜 잘생겼네,48,2023-11-13T06:25:20Z
@ungkim4170,한국남자들아 외국으로 눈을 돌려라. 여러나라 여자들 만나봤는데 만나고나면 현타와서 한국녀들 못만난다.,0,2023-11-12T04:22:48Z
@user-rc4kr8ss8n,중국유학시절에만난 이란인여친이 그립네 잘살고있으려나,1,2023-11-12T04:13:43Z
@내가니형이다,친북 국가 이란 🤣,1,2023-11-11T21:51:55Z
@Beidaily2019,"이란“ 하면 남자가 권위적이고 다소 폭력적 선입견이 있어요 영화를 봐서 그런지,,<br>한국 남편이 참  스윗하시네요 안정환선수처럼 ^^ <br>이란에서 선한 영향력을 일으켰으면 좋겠네요 ,,",2,2023-11-11T18:43:57Z
@user-of7vu1xs3p,히잡을 벗어라 두렵다 반국가 세력될수도 한국사회 협조하길,0,2023-11-11T11:56:06Z
@user-ds2tq6dm4h,정확하게는 한의사가 아니고 중의사라고 합니다.<br>저분 &quot;이란공주. 한국온달&quot;채널 유튜브를 하고 있고 중국으로 중의학을 공부하러 유학갔을때 만났다고 합니다.,11,2023-11-10T09:10:49Z
@miajun8674,와  아내도 천사같지만 아이들도 너무 잘 생겼다. . 행복하시고 보물들 잘 키우세요 ❤❤❤,58,2023-11-09T12:19:27Z
@빠방pabang,중국분들은   이란에서 한의원 안하나,1,2023-11-08T23:59:02Z
@빠방pabang,한의원님도   x레이를 보네,3,2023-11-08T23:58:26Z
@빠방pabang,이란 여성분들이 외모가        저런외모 닮으려고    수십억쓰는ㄷ,1,2023-11-08T23:57:01Z
@여수갈,♡♡♡,2,2023-11-07T22:56:45Z
@dhpark9021,"이란이 한국의 우호국인데, 이란과 미국 관계 때문에 한국이 새우등 터지는 거지.<br>울나라 석유를 이란에서 많이 들여왔었는데, 그거 다 막히고...<br>서울에 가면 테헤란로가 있고, 이란에 가면 삼성로가 있다는....",2,2023-11-07T11:10:35Z
@廣川仁志,회교도랑 결혼자체가 파멸이지,0,2023-11-06T23:53:55Z
@chongkumsun9185,어느나라든 서로가 존경하고 사랑하고 건강하게 잘살면되요~~^^ 사랑에는 국경이 없어요. 두분 건강하시고 행복하시고 응원합니다 👍 💜 😊,29,2023-11-06T20:58:36Z
@user-ib1zk8qe7r,이름 다못외우겠어요,1,2023-11-06T12:51:48Z
@jinpark5193,군에 있을때 걸프전이 터졌다. 군에 비상이 걸렸고 매일 전투복입고 전투화를 신고 취침을 했다. 조만간 한국이 파병할거란 이야기들이 돌았다. 당시 너도나도 파병을 간다면 꼭 지원하겠다고 했다. 중동 여자들이 이쁘기 때문에 꼭 가야한다고 다짐에 다짐들을 했다. 물론 파병은 없었다.<br>오래전 추억이다. 오늘 방송을보니 이란 여성분들이 이쁘시다.,2,2023-11-05T18:02:38Z
@user-kn2du4oc7r,돼지고기는 평생 못 먹겠네요!,0,2023-11-05T13:07:52Z
@bigbike29ers17,새헤밍턴 수염깍고 깨끗한 모습보여라.,2,2023-11-05T08:49:59Z
@버디맨,부럽<br>쾐히   한국여자랑  결혼  ㅋ<br>이혼하고 이란여자랑  결혼하고 싶다요,2,2023-11-05T08:05:08Z
@user-jv8xo4ne8j,이란여자들!!<br>이슬람교 전파하기 위해 결혼을 사용한다!!,1,2023-11-05T01:14:11Z
@user-uw2nm8em2l,이슬람은  애가 축복이라 여겨  무조건  많이 낳는다네요  우리나라  에 이슬람  커플 1000쌍 이  있다고 생각해보세요 10년후  어떻게될지  끔직합니다.  이슬람사원  결사반대.,9,2023-11-04T23:59:02Z
@튜립아이,아내는 천사  👼,21,2023-11-04T17:22:58Z
@user-en2lb9yg7i,이란도  팔레비  왕조부터  변하기  시작하더니  호메이니  때부터  골치 아픈나라로  변하였음  원래  페르시아  재국으로  영토도  넒고  대단한  나라였는데  이슬람 국가들과  교류하더니  골아픈  나라가되었지,3,2023-11-04T07:29:46Z
@user-rd3wc8ej8b,역사는 우연이 아닙니다.<br>쿠쉬나메<br>페르시아 왕자와 신라 공주가 결혼해<br>출생한 왕자가 무너진 페르시아를 재건하죠.<br>동경인 경주에 있는 왕릉에 당당하게 그 앞을 지키고 있는 석상도 페르시아인<br>이죠.,6,2023-11-04T05:01:18Z
@younilkim6169,진짜 페르시아 공주님 이십니다^^<br>장인어른께서  결혼승락조건으로 이란에서 살라고,12,2023-11-04T04:18:42Z
@_bjdj5506,이란에서 여자들 희잡안쓰고 버스 탔다가  맞아 죽었다고 하더이다..<br>종교에 미친나라 임.   이란이   이스라엘  하마스 전쟁에도 개입한 것 같은데  조심하셔야..,4,2023-11-04T02:36:07Z
@aaaA-hq9ik,한국으로 들어와야 할 거 같은데…이란 자꾸 깝치는 꼬라지가 미국이랑 이스라엘에 처맞을거 같은데…😅,1,2023-11-03T19:51:10Z
@user-nc4om7pk1h,남편분 관상이 너무 좋아요. 미안 하지만 시집 잘 가셨습니다.한국에서도 상위1% 안에 드는 좋은 관상 입니다,6,2023-11-03T15:08:37Z
@jaebumkwon4867,남편이 훨 아깝,2,2023-11-03T13:24:00Z
@nuwana8504,이란인들 요새 조용하네ㅠ 혁명의 전사들 어디갔어요? 빨리 정권교체 하시길.,0,2023-11-03T11:03:52Z
@NeonEvan,어? 이든이 아빠네? 방송에 나왔네. 반갑네.ㅎ,9,2023-11-03T06:33:45Z
@byunghoyoo,중국에 가서 중의학을 베워서 한국에서는 인정을 안하는 중의사인데...이란에서 유일한 한의사는 거짓입니다.(한의학을 베우면 한의사 중의학을 베우면 중의사지요.)<br>중의학을 깔려는 것은 아니지만....펙트첵크는 필요하다고 봅니다.,2,2023-11-03T04:36:42Z
@user-yv5zm8en7p,금은 아이 선물이 아닌듯 ㅋㅋ,3,2023-11-03T04:26:59Z
@user-yv5zm8en7p,"<a href=""https://www.youtube.com/watch?v=vqKdRLoM7j8&amp;t=588"">9:48</a> 부인에 대한 사랑이 느껴진다 ㅎ",19,2023-11-03T04:26:12Z
@user-oo5fs7xv7d,테러지원국  이란   꺼져...,8,2023-11-03T04:00:16Z
@chankyukang1127,대부분 무슬림에게 여성이란 소유물의 개념이 강한것 같아서 우리나라 여성 이란가서 살면 못 살듯.,0,2023-11-03T01:02:22Z
@user-nw3vc9us1d,종교국에서  남편 이슬람 된거 아닌가?,5,2023-11-03T00:33:48Z
@최호준-f5f,한의학이 아니라 중의학인 걸로...,2,2023-11-02T23:51:33Z
@lee-pl4wc,살고싶으면 이란을 떠나라 이란이란 나라는 신에 미처 날뛰는 미친 나라 아닌가 한국으로 돌아오시요,5,2023-11-02T23:02:27Z
@zlahan88,한국 남자 복 받으셨네<br>3명 더 가능하니,3,2023-11-02T21:47:35Z
@jongkim9292,이혜원은 남편 따라 티비에 같이 나오네 앉아서 수다만 떨면 되니 너무나 쉽지요.안정환은 방송계서 성공 했지요 김성주 씨가 물론 뒤에서 밀어 줬고.,5,2023-11-02T21:07:15Z
@jongkim9292,효과를 보니깐 이란서 좋아 해요.,5,2023-11-02T20:56:44Z
@jongkim9292,이란 여자들 히잡 벗으면 다들 너무 예뻐요 눈도 크고 눈썹 길고 태도도 도도 한데 이 분은 부드럽네.,6,2023-11-02T20:55:31Z
@loo1700,저 결혼은 신부측 부모가 허락해서 한 결혼이기 때문에 걱정할 필요 없어요   보통 명예살인 나는 경우가 자신들 가족신분보다 한참 떨어진 신랑측 불가천민이여서 반대하는 경우가  생기고 명예를 실추 됐다고 생각하고 잡음이 생기고 그런 불상사가 생기죠   한국신랑은 의사이기 때문에 신분측 가족분들 입장에서는  한국신랑을 높은 신분으로 보고 있습니다,20,2023-11-02T18:33:52Z
@user-lg4yt6kj9l,무슬림전사 2명 탄생이군,4,2023-11-02T16:24:43Z
@love20000430,❤❤❤❤❤❤❤,1,2023-11-02T14:44:12Z
@user-yz7dm8db6i,한국오지마시고이란에서행복하게사세요,4,2023-11-02T10:44:06Z
@Joeohhhh,이란은 ‘아리아인의<br>나라’ 라고 합니다. 역시 이쁜 아리아인 부인 결혼하신 남편분 부럽네요🎉,21,2023-11-02T08:28:48Z
@gracekim3031,이란 여자들 집안에서도 보자기 머리에 쓰고있는것 너무 답답해보인다.,8,2023-11-02T07:03:19Z
@user-cv3hl6be9v,아무리 포장해도 이슬람은 거르자,8,2023-11-02T06:22:34Z
@대강대충,"이란 누나들 이쁘다 70,80 년대이란으로 돌아왔으면",5,2023-11-02T04:58:30Z
@user-pi5yb2kc9v,역시 페르시아! ㅎㅎ,3,2023-11-02T03:51:24Z
@headbreaker1761,무슬림이면 남자도 이슬람으로 개종 하지 않는 이상 결혼 못할걸?,2,2023-11-02T02:01:14Z
@user-cm2wv4ls9h,내용도 너무 재미 있지만 mc 이혜원님 너무 안정적이고 너무너무 잘하세요 ~,18,2023-11-01T23:53:25Z
@구름을걷다,전나 이쁘네 일도 열심히 그럴만하네 이란여자 이민받자,5,2023-11-01T19:33:40Z
@user-zr2po3dk7r,저분 유튜부보니 이란음식 먹어보구 싶던데,7,2023-11-01T16:23:36Z
@이영철-l2s,국제부부 두분  이란에서 행복하게 사세요...,21,2023-11-01T14:02:21Z
@user-hd3mm6tg4e,이란은 무슬림입니다,8,2023-11-01T12:54:03Z
@user-iy4zgdjn3,"이란<br>빵,아이스크림 진짜 개 맛있는데<br>정부가 문제지<br>국민과문화는<br>80년도~90년대 한국 같음<br>건물들과차들은<br>90년도~00년대 한국 같고<br>한국인으로써도 별로 어색하지가 않음<br>매연 땜시 더러운것 빼면.",1,2023-11-01T11:58:21Z
@파워-i5m,"이란은 나라가 폐쇄적이어서 그렇지, 사람들은 무진장 친절하고 따뜻했다.<br>가족 단위로 나들이 나와서 돗자리 깔고 식사를 하는데 지나가는 내게 같이 먹자고 초대하질 않나, 길을 물어 보는데 아기를 안고 있던 남편이 부인에게 맡기고 함께 횡단보도까지 건너서 안내해 줄 정도였다 ~<br><br>전공판에 44도를 기록하는 더위 속에 관광객이라도 여성들은 히잡을 쓰지 않으면 &#39;도덕 경찰&#39; 에 끌려가게 돼서 그렇지, 이란 사람들은 단연 최고였다 !",8,2023-11-01T11:33:37Z
@아레나-g2w,음식치료 샤프란 마늘처럼 암도 가능한가요?,1,2023-11-01T11:31:50Z
@superyt4ever,아무리 사랑엔 국경이 없다고 천진난만한 구호가 있지만 이슬람 테러리스트 국가로 악명이 유명한 이란으로 가서 무슬림 가시나랑 가정을 꾸리는 게 자랑이냐? 북한과 긴밀한 무기와 도발작전을 교환하는 테러국가 이란이다.  하마스나 헤즈볼라 같은 테러 집단을 지지하고 지원하는 테러 수출 국가다. 저 남편이란 한국놈 내생각에는 미국과 대립하는 국가에 친근감을 가진 전형적인 호남 출신이나 본관이 호남이인 놈 같다.,4,2023-11-01T11:06:15Z
@user-wn5be1st4u,가잘 ㅅㄱㄲ인거 다 알려졌는데!! ㅜ.ㅜ,0,2023-11-01T10:37:33Z
@AACANE,무슬림 양성계획에 동참한 한국인 이군.<br>무슬림 율법상 남자는 타종교 여자랑 결혼해도 상관없음. 대신 자식은 무조건 자동으로 무슬림.<br>여자는 타종교 남자랑 결혼금지. 결혼 하려면 남자는 무조건 무슬림으로 개종해야함. 따라서 자식은 자동으로 무슬림.<br>이런 좆같은 이슬람 율법에 협조하는 좆같은 한국인.,4,2023-11-01T09:51:08Z
@퐁퐁찌이익,한녀와 결혼해서 지옥을 겪는것보다 100배 보기 좋음 행복해보임😊,0,2023-11-01T09:10:21Z
@블루칩-f8o,이분 한의사가  아니고 중의사임.  병원을 보면 전부 중국풍임. 잘못된 정보도 가짜 뉴스 입니다.  반드시 시정해야 함.,4,2023-11-01T08:45:21Z
@user-iq2ki2pn4p,이란 정부가 야만인들이라 이란국민들 고생이 많다,11,2023-11-01T08:22:31Z
@Nabi_socute,댓글보니 중의학인거 같은데 중의학 한의학 구분 좀 해주지,8,2023-11-01T08:22:12Z
@user-cd9qp7sg8b,한의사가 아니라 중의사일 듯.,13,2023-11-01T05:17:16Z
@잠실해동검도,이란은 무서워서  생각도 못해요😢  사는건 평범하네요,18,2023-11-01T03:59:40Z
@비트광산,빵가격을 말을 안하내     이란  빵 존나쌈   우리나라 세계에서 제일 비쌈  식품 카르텔 전부 죽여야된다,7,2023-11-01T02:48:28Z
@리치몬-r7c,구미나 서구국제부부는 시청률바닥인데. 이부부. 나온거 조회수 폭발이네,3,2023-11-01T00:03:24Z
@yeong20,한의사 좋아하네. 중국서 공부하고 개업한 중의사인데,20,2023-10-31T09:44:27Z
@user-dn2ml8mp4t,친일매국노 채널a 에 나오다니<br>구독 모두 삭제중..<br>적어도 어떤 방송국인지 알고 나와야지,2,2023-10-30T09:07:55Z
@뭐없다,다행히 둘다 아들이네 <br>딸이었으면 어쩔뻔 이슬람 답 없는데,13,2023-10-30T07:44:34Z
@user-ms3nu2ik6z,아니 근데 한의사 남편이란 친구 한국에 사는 중국 화교 출신 아니냐?<br>유튜브 채널 보니까 여기저기 생활 주변에 눈에 띄는 건 전부 중국 물건들이던데?,22,2023-10-30T07:24:23Z
@기파랑-y1x,가잘 안보이더니   방송으로  갔구나....   여전히  이뻐...,17,2023-10-30T03:40:23Z
@martinkim7285,내게도 천사같은 여자가 있었지....이루어지지 못한 <br>ㅠㅡㅠ,6,2023-10-30T02:13:07Z
